name,locality,lat,long,review
Chaat Lane,"Shop 3, Survey 4, Thubarahalli Village, Near Spectra Cypress, Whitefield, Bangalore",12.9559725278,77.7177076042,21
Lemone,"2/1, Golden Fins Sport Club, Main Road, Kumbena Agrahara, Whitefield, Bangalore",13.0054525000,77.7489061000,24
Frozen Bear,"1, Ground Floor, Vijaya Bank Colony, Gayathri Layout, Near Basavanapura Government School, KR Puram, Bangalore",13.0097596000,77.7092027000,26
Gowdru Hotel,"Shop 3, KSVK School Road, Hagadur, Whitefield, Bangalore",12.9691225208,77.7539938688,95
Hyderabadi Spicy Biryani,"Opposite 8th Cross Road, Shiridi Sai Baba Layout, Marathahalli, Bangalore",12.9487451000,77.7130019000,291
Zaikedar Biryani,"Room 1, 1st Floor, Kundanahali Colony, 11th Cross, Brookefield, Bangalore",12.9716994000,77.7117326000,103
The Foody Station,"66/8, Siddapura Main Road, Near HP Petrol Bunk, Whitefield, Bangalore",12.9658890000,77.7334730000,469
Randal Kafi,"61, Shiva Ganga Layout, Saraswathi Nagar, Mahadevapura, Kaggadasapura, Bangalore",12.9893337001,77.6893941001,0
Cibo Matto,"Shop 10 & 11, Myhna Square, Vinayak Nagar, Varthur Main Road, Whitefield, Bangalore",12.9288493000,77.7383190000,0
The Dripping Cone,"710, Varthur Main Road, Whitefield, Bangalore",12.9560656490,77.7215468511,207
Nazrana Biryani,"55/1, Shirdi Sai Layout, 8A Cross, Near Sai Baba Temple, Marathahalli, Bangalore",12.9489020000,77.7120523000,0
Oakleaf,"62, Forum Value Mall, Oakwood Residence Prestige, Whitefield, Bangalore",12.9599346000,77.7487670000,49
Khan's Biryani Zone,"55/1, Near Sai Baba Temple, Shirdi Sai Layout, 8A Cross, Munnekolala, Marathahalli, Bangalore",12.9488634538,77.7129061800,37
Khichdi Centre,"Hoodi, Graphite India Road, Mahadevapura Post, Brookefield, Bangalore",12.9890490000,77.7156610000,45
Sandwich Junction,"37/1, 10th cross, Shridi Sai Nagar, Near Sai Baba Temple, Marathahalli, Bangalore",12.9485028000,77.7133078000,123
Combo Kitchen,"55/1, Sai Baba Temple Road, Munekolalla, Marathahalli, Bengaluru",12.9487470000,77.7130184000,272
51 Indian Restaurant,"Shop 1 & 2, 51, Sai Garden Layout, Thubarahalli, Mahadevapura, Brookefield, Bangalore",12.9529050674,77.7175363399,14
Kurtosshhh,"Unit 010, The Forum Shantiniketan Mall, Survey 77/2, (Old) New Survey 77/2a, 77/2b, Itpl Road, Sadaramangala Village, K R Puram Hobli, Whitefield, Bangalore",12.9898345000,77.7281288000,184
MM Bangarpete Pani Puri Center,"Shop 1, Ground Floor, Gayatri Layout, Basavanapura Main Road, Opposite 22nd Cross, KR Puram, Bangalore",13.0099690000,77.7085250000,0
Tashann,"1st Floor, Aakash Arcade, 80 Feet Road, Outer Ring Road, Near Ranganatha Layout, Mahadevapura, Marathahalli, Bangalore",12.9876251711,77.6857698709,113
Shao - Radisson Blu,"90/4, Munnekollaly Village, Outer Ring Road, Marathahalli, Bangalore",12.9497617598,77.6992969215,464
Bangali Radhuni,"35/1B, 3rd Floor, CRM Sowbhagya Annex, Varthur MainRoad, Munnekolala, Marathahalli, Bangalore",12.9563864000,77.7099479000,29
Anand Bhavan Resturant,"Cambridge Garden, Kodigehalli Main Road, KR Puram, Bangalore",13.0042469000,77.7205601000,15
Hyderabadi Biryani Junction,"37/1, 7th Cross Shridi Sai Nagar, Near Sai Baba Temple, Marathahalli, Bangalore",12.9486747000,77.7131009000,0
Siri Bangarpet Chats & Tiffen Corner,"Shop 03&04, Near Sea College Arch, 2nd Cross Muneshwara Layout, Ayyappanagar, KR Puram, Bangalore",13.0046142000,77.7129770000,20
Chainaama,"89, 1st Main, 6th Cross, Ramagondanahalli, Whitefield, Bangalore",12.9563673810,77.7410810538,13
Momo Company,"122, Outer Circle, Dodsworth Layout, Whitefield, Bangalore",12.9700100000,77.7495300000,19
Goodness To Go By Smoke House Deli,"63/012, Unit 12, Lower Ground Floor, Sadaramangala Village, ITPL Main Road, Whitefield, Bangalore",12.9893383763,77.7283844724,891
Momos & Meals,"211, First Floor, Channasandra Main Road, AKG Colony, Kadugodi Post, Near MVJ College, Whitefield, Bangalore",12.9826490656,77.7627039911,50
Frizzles Kitchen,"140, Sri Nivasa Reddy Layout, 3rd Cross Road, Brookefield, Bangalore",12.9656566125,77.7125108242,79
Bangarpet Pani Puri,"Shop 1, Opposite Sai Baba Mandir Shirdi Sai Nagar Munnekollal Marathahalli, Bangalore",12.9489592670,77.7132155369,99
New Gfc Gowdas Biriyani,"2/3, Ground Floor, Sarojamma Govinda Reddy Layout, Thubarahalli Village, Brookefield, Bangalore",12.9514873154,77.7174209431,63
Indian Paratha Company,"Forum Neighbourhood Mall, Survey 62, Whitefield, Bangalore",12.9598362110,77.7479273423,1
Accidental Engineer,"301, Brindavan, Yellareddy Circle, Railway Station Road, Kadugudi, Whitefield, Bangalore",12.9957960000,77.7659990000,663
Bikram Sweets And Snacks,"G1, JRS Complex, Ground Floor, Opposite Whitefield Railway Station, Whitefield, Bangalore",12.9970293592,77.7612049878,159
Market Cafe,"62, Ground Floor, Forum Neighborhood Mall, Whitefield, Bangalore",12.9598492782,77.7477258816,2404
Just Bake Cakes,"31, 4th Floor, 2nd Cross, Venketeswar Layout, Marathahalli, Bangalore",12.9512751000,77.7098958000,0
Dahi Besar,"Shop F6, SY 122/2, CKB Complex, Meadows Apartment, ITPL Main Road, Whitefield, Bangalore",13.0128486000,77.7626514000,229
Veg Khana,"55/1, Shirdi Sai Layout, 8A Cross, Near Sai Baba Temple, Marathahalli, Bangalore",12.9488902925,77.7130072847,60
Roti Express,"Sai Baba Temple, Munekullla 10th Cross, Marathahalli, Bangalore",12.9487749758,77.7121054754,446
The Raja's,"26/2, Panathur, Outer Ring Road, Kadubeesanahalli, Bangalore",12.9401391419,77.6953178644,10
Andhra Aromas,"107, Sugruha, Pattandur Agrahara, Near ITPL Back Gate, Whitefield, Bangalore",12.9835763819,77.7332281549,32
Hyderabadi Traditional Biryani,"8, 1st Floor, Vaikuntam Layout, Lakshminarayana Pura, D Block, 5th Cross Road, Marathahalli, Bangalore",12.9486747000,77.7131009000,0
Punjabi Food Joint,"191A-5, Kamadhenu Nagar, Near Government High School, KR Puram, Bangalore",12.9978963848,77.6876970381,110
House Of Juice,"710, Opposite Karur Vysya Bank, Thubarahalli, Varthur Main Road, Whitefield, Bangalore",12.9560656490,77.7215468511,226
Omleterian,"948, 2nd Floor, Near Raja Palya Auto Stand, Raja Palya, Hoodi, Whitefield, Bangalore",12.9914155075,77.7210553363,719
Go Naati,"Unit FC-17, Pheonix Mall Food Court, Mahadevapura, KR Puram, Bangalore",12.9977217000,77.6970874000,0
Biriyani Paradise,"497/1, 2nd Main Road, Aswatha Nagar, Marathahalli, Bangalore",12.9572422397,77.7027733997,4
Mutton Point,"55/1, Shirdi Sai Layout, 8A Cross, Munnekolala, Sai Baba Temple Road, Marathahalli, Bangalore",12.9489020000,77.7120523000,0
Miami Shakes & More,"11B, SY 40/9, Devasandra Industrial Area, 2nd Stage, KR Puram, Bangalore",12.9962600000,77.6956400000,2
Bodypower Cafe,"Hagadur Main Road, Immadihalli, Near De Moza Warehouse, Varthur Main Road, Whitefield, Bangalore",12.9640219000,77.7619413000,58
Crazy Bao,"66/2, 67/1, Garudacharpalya Whitefield Main Road, Mahadevapura, KR Puram, Bangalore",12.9940462000,77.6993082998,17
Kickstarter,"64/3E, Nallurhalli Main Road, Opposite Doddamma Temple, Whitefield, Bangalore",12.9679128000,77.7341135000,0
Bhai Biryani - Ambur Biryani & Kebabs,"Shop 1, C-3, Ground Floor, Silver Spring Layout, Near Spice Garden, Marathahalli, Bangalore",12.9591024000,77.7084403000,0
The Chatpata Affair,"4th Floor Food Court, Ascendas Park Square Mall, ITPL Main Road, Whitefield, Bangalore",12.9870427000,77.7364760000,13
Cream & Fudge,"Shop 8, Survey 66/1, Hoodi Kodigahelli Main Road, KR Puram, Bangalore",13.0045335712,77.7148533985,18
Ultimate Tandoor,"Room 1, 1st Floor, Kundanahali Colony, 11th Cross, Brookefield, Bangalore",12.9716994000,77.7117326000,122
Shreyas Pork And Chicken Hotel,"325, Segehalli, Chickbanahalli Road, Whitefield, Bangalore",13.0151893000,77.7606389000,0
Taaka Chinese,"161, Khatha 161, Khatha 255, Site 12, Patandur Agrahara, Mahadevapura, ITPL Main Road, Whitefield, Bangalore",12.9859740000,77.7450010000,0
Maa Ka Swad,"Hoodi, Graphite India Road Mahadevapura Post, Bangalore, Mahadevapura, B.B.M.P East",12.9890490000,77.7156610000,0
Noodle,"11, Lower Ground, Forum Shantiniketan Mall, ITPL Main Road, Whitefield, Bangalore",12.9895339485,77.7281109851,20
Ghar Ka Tadka,"355, 28/1, 1st Floor, Hoodi Village, Whitefield, Bangalore",12.9916178000,77.7136297000,56
Arogya Thaana,"06, Prashanthi Complex, Channasandra Main Road, Whitefield, Bangalore",12.9824505269,77.7670860663,58
Biryani Plaza,"98/A, Sri Manjunath Layout, Munnekolala, Marathahalli, Bangalore",12.9497885532,77.7125017717,501
The Baker's Dozen,"Whitefield Main Road, Converge By Ukn Airport, Whitefield, Bangalore",12.9635021576,77.7323373780,427
The Twenty Handmade Chocolates,"23, Rainbow Hospital Road, Opposite Alpine Eco Apartment, Marathahalli, Bangalore",12.9731057729,77.7002511423,1
Howrah Bridge,"121/2, ITPL Main Road, Brookefield, Bangalore",12.9643250000,77.7178660000,90
Enchanté by Chai Point,"77/2A And 77/2B, Forum Shantiniketan Mall, Sadaramangala, Whitefield, Bangalore",12.9897032000,77.7281353000,0
Malabar Darbar,"55/1, Shirdi Sai Layout, 8A Cross, Near Sai Baba Temple, Munnekolala, Marathahalli, Bangalore",12.9489020000,77.7120523000,0
Bowlss Of Bliss,"9/91, 1st Floor, Thubarahalli, Varthur Main Road, Whitefield, Mahadevapura Brookefield, Bangalore",12.9556892468,77.7196213411,1
Cafe N Town,"Survey 129, Deshagowdara Racche, Thirumalappa Layout, Whitefield, Bangalore",12.9630116000,77.7608774000,0
Nevesa Bites,"Site 36, 37, 1st Mania, 60 Feet Road, AECS Layout, Mahalakshmi Farms Road, Marathahalli, Bangalore",12.9631218000,77.7073812000,9
Miami Waffles & Jawbreakers,"11B, SY 40/9, Devasandra Industrial Area, 2nd Stage, K R Puram Hobli, MD Pura, Haniyur, KR Puram, Bangalore",12.9962600000,77.6956400000,0
Wall Street Shack,"189/3, 2nd Floor, Room 3, 3rd Cross, Gandhipuram, Whitefield, Bangalore",12.9726929308,77.7542996407,167
The Big Bang Sky Deck And Lounge,"Fifth Floor, Bearing K 223, 220B, Sadaramangala Village, KR Puram, Bangalore",12.9882909834,77.7298291773,741
Sri Sai Ram Foods,"SY-21, Member D, Annappa Layout, Immadihalli, Whitefield, Bangalore",12.9671979000,77.7590765000,0
Express Cafe,"Holiday Inn Express, Plot 4, EPIP Zone, Near Harman Building, ITPL Main Road, Whitefield, Bangalore",12.9863082427,77.7323886752,9
ATR Foods,"Shop 3/1, Kundalahalli Gate, Aravind Avenue Road, Brookefield, Bangalore",12.9573679000,77.7145012000,6
Vijay Kitchen,"533, B Block, AECS Layout, Brookefield, Bangalore",12.9648178998,77.7176231146,21
Amrit Bhog - Jain Food,"595, SK Arcade, ACES Layout, 1st Main Road, Brookefield, Bangalore",12.9642114896,77.7150139958,2667
Iyengar's Bread Basket,"51, Green Garden Layout, Shirdi Sai Temple Road, Marathahalli, Bangalore",12.9504315944,77.7156034112,1525
A 2 Z Momo King,"204, Survey 115, 2nd Cross, Channasandra Main Road, Opposite MVJ College, ITPL Main Road, Whitefield, Bangalore",12.9825591000,77.7619224000,19
Biryani Festival,"1, 1st Main, Ambedkar Nagar, Whitefield, Bangalore",12.9798731291,77.7524780855,5
Cake Creation,"40/1, 1st Floor, 2nd Cross, Panchamukhi Anjaneya Temple Road, Immadihalli, Whitefield, Bangalore",12.9655184064,77.7643170208,33
Chole Bhatura And Parathas,"65, Siddapura, First Main Vartur Main Road, Mahadevapura, Whitefield, Bangalore",12.9508946000,77.7310637000,253
J H B Cafe,"Basaveshwara Nilaya, Sachidananda Ashram Road, Oppositet To Subhodaya Apartment, 2nd Main, 8th Cross, Belathur, Kadugodi Post, KR Puram, Bangalore",13.0071450777,77.7545979259,62
World Of Combos,"101, Eralappa Nilaya, Sreenivasappa Layout, Sheegehalli, Near Axis Bank, ITPL Main Road, Whitefield, Bangalore",13.0121270631,77.7626993135,22
Wrap It,"Kitchen 17, Kitchen Plus, Converge 78/2, Situated At Siddhapura, Whitefield, Bangalore",12.9633740280,77.7324185301,109
Anika Restaurant,"65, Siddapura, 1st Main, Varthur Main Road, Whitefield, Bangalore",12.9508946000,77.7310637000,19
La Burgerita,"Shop 229, Gramatana Temple Road, Near Haraly Katte Pattanduru Agrahara, Whitefield, Bangalore",12.9802433000,77.7336853000,0
Amoeba Sports Bar,"3rd Floor, Ascendas Park Square, ITPL Main Road, Whitefield, Bangalore",12.9871295678,77.7366755158,670
Kolkata Recipe,"124, Pattandur Agrahara Main Road, ITPL Back Gate, Whitefield, Bangalore",12.9825850000,77.7335300000,0
Ocean Cake,"204, Ramagondanahalli, Jagriti Apartment, Whitefield, Bangalore",12.9568374095,77.7411913499,0
Carlos Cakes,"47, Girijamma Building, Opposite Chinnappanahalli Government School, Marathahalli, Bangalore",12.9570361000,77.7027593000,23
Punjab Da Kitchen,"43, 1st Floor, Kundanahalli Gate, Varthur Hobli, Marathahalli, Bangalore",12.9555806346,77.7144516706,0
TT's Kitchen,"11/3A, Whitefield Main Road, Mahadevpura, Whitefield, Bangalore",12.9669301956,77.7512439340,14
Pabrai's fresh and Naturelle Ice Cream,"Survey 78/2, Siddpura Village, Varthur Hobli, Whitefield, Bangalore",12.9636000000,77.7329076281,0
Maa Tea,"21 & 22, G6 Food Court, Property 130, Khata 51, Munnekolala, Marathahalli, Bangalore",12.9467321244,77.7150679752,7
Meatwale.Com,"Shop 2, K N Arcade, Vijayanagar Main Road, Opposite NVT Life Square, Whitefield, Bangalore",12.9753787000,77.7643631000,0
Aarya Home Made,"19, 2nd Floor, Munnekollal, Lakshmi Narayana Swamy Temple Road, Marathahalli, Bangalore",12.9498860335,77.7092957497,71
Annamandir,"T-3, 14/P1, 3rd Floor, Uma Shankar Avenue, Hagadur Road, Whitefield, Bangalore",12.9624962000,77.7493917000,0
Kolkata Famous Kati Roll,"Laxmi Sagar Layout, Mahadevpura, Kaggadasapura, Bangalore",12.9890849688,77.6891486766,0
The Vada Company,"3rd Floor, M S Commercial Building, Seegehalli, Kadugodi, Opposite Shell Petrol Pump, ITPL Main Road, Whitefield, Bangalore",13.0174377345,77.7622990357,0
The Diner,"107/4, Ist Floor, Near ITPL Gate 3, Pattandur Agrahara Main Road, Whitefield, Bangalore",12.9842923000,77.7334466000,19
Chiness Food Corner(CFC),"252, Shop 1, 1st Cross, Kundanahalli Colony, Mahadevapura, Brookefield, Bangalore",12.9690944210,77.7127903092,33
Genie Menie Combos,"Room 3, 2nd Floor, 3rd Cross, Near Ganesha Temple, Gandhipuram, Whitefield, Bangalore",12.9726720208,77.7543447016,86
Namma Nati Mane,"House 1, Basaveshwara Nilaya, Sachidananda Ashram Road, Opposite Subhodaya Appartment, 2nd Main, 8th Cross Belathur, Kadugodi, Marathahalli, Bangalore",13.0066000000,77.7551800000,297
Amritsari Haveli,"595, Ground Floor, Kundalahalli, Brookefield, Bangalore",12.9642356676,77.7150300890,58
Cafe'ISH,"211, First Floor, Both 2, AKG Colony, Channasandra Main Road, Kadugodi, Near MVJ College, Whitefield, Bangalore",12.9825518058,77.7627431847,0
A1 Food Services,"Shop 5, Manjunath Nagar, Seegehalli Main Road, Virgonagar Post, KR Puram, Bangalore",13.0182080000,77.7199160000,136
The Flower Tart,"Shop 2, KCR Residency, Shirdi Sai Nagar Main Road, Munnekolala, Marathahalli, Bangalore",12.9477279000,77.7153513000,0
Chiller's Nation - Iris Inn,"21, 22/3, Outer Ring Road, Mahadevpura, Marathahalli, Bangalore",12.9906415674,77.6874868199,44
Chetty’s Corner,"38/B1, Ground Floor, Kunnaj Arcade, AECS Layout, L N Pura, Brookefield, Bangalore",12.9599581000,77.7137799000,0
Sugar Cane Wala,"5th Cross, Akkamma Layout, Near Anjaneya Temple, Kaggadasapura, Bangalore",12.9889505000,77.6870039000,120
Kolapasi,"3/1 A, Arvind Avenue, Kundalahalli Gate, Brookefield, Bangalore",12.9573225521,77.7144430876,46
Lalaji Ki Kulfi,"3rd Floor, Brookfiled Mall, Brookefield, Bangalore",12.9658395000,77.7179513000,0
Habba Kadal,"326, Inner Circle, Ward 84, Hagadooru, Whitefield, Bangalore",12.9721126773,77.7491337061,74
Prasuma Momo Kitchen,"710, Thubarahalli, Varthur Road, Brookefield, Bangalore",12.9562850000,77.7215000000,109
Chinese Town,"121/2, ITPL Main Road, Near Brookfield Bus Stop, Brookefield, Bangalore",12.9641483000,77.7177221000,197
Tea Time,"Shop 10, N.S. Complex, ITPL Main Road, Opposite To Bank Of Baroda, Brookefield, Bangalore",12.9566384249,77.7146404982,282
Coco Hut,"14/9, Prashanti Nilayam, 4th Cross, Whitefield, Bangalore",12.9633097129,77.7485603839,40
Tea Bites Cafe,"Arjampudi Residency, Sri Laxmi Narayanasami Temple, Munekullala Bengay, Marathahalli, Bangalore",12.9492521389,77.7092542261,7
Jai's Biriyani Mane,"6/6 Ground floor, Jayaram Reddy Building, Next To Meghna Hospital, Hoodi Whitefield, Bangalore",12.9939000054,77.7172717452,0
Dan's Eatery & Creamy,"1/5, The Twin Oaks, Nallurahalli Circle, Whitefield, Bangalore",12.9697246717,77.7355265245,5
Ketchup Momos,"Sriram Arcade, Parking Area, Seegehalli, ITPL Main Road, Whitefield, Bangalore",13.0124525000,77.7625179000,0
Mom's Cook House,"125, 1st Cross, Manjushree Layout, FCI Godown Road, Channasandra, Kadugodi, Whitefield, Bangalore",12.9857921339,77.7669409514,75
The Winner's Taste,"35/lB, Varthur Main Road, Munnekolala, Mahadevapura, Marathahalli, Bangalore",12.9563864000,77.7099479000,22
The Wuhan Story,"23, 1st Floor, Sri Ram Complex, Vastu Bhoomi Layout, Seegehalli, Hosote Road, Whitefield, Bangalore",13.0163178393,77.7624106407,0
Toast - Pizzeria & Burger,"22, 23, Upper Ground, Forum Shantiniketan Mall, ITPL Main Road, Whitefield, Bangalore",12.9898352820,77.7281128988,112
Kolkata Sweets,"9, 10, 1st Cross, Shree Shakti Layout, Kodigehalli, KR Puram, Bangalore",13.0058100000,77.7337400000,79
Apni Dukan,"87, Munnekolala, Kundanahalli Gate, Marathahalli, Bangalore",12.9498708939,77.7156496793,176
Sai Ram's Cafe,"Ground Floor, DSR Atrium, ECC Road, Whitefield, Bangalore",12.9840487681,77.7439821884,79
Sandwich Grill,"02, Shiridi Sai Nagar, 7th Cross, Near Sai Baba Temple, Marathahalli, Bangalore",12.9487416472,77.7131220326,41
Falafel Fresh,"Shop 6, 16th Cross, Gayatri Layout, Basavanapura Main Road, KR Puram, Bangalore",13.0133390000,77.7091589000,38
The Coffee House,"229/321, SY 40/1, Ground Floor, Pattandur Agrahara, ITPL Main Road, Whitefield, Bangalore",12.9835260411,77.7532183751,40
The Corner Shop,"171, 3rd Cross, Kundalahalli Colony, ITPL Main Road, Brookefield, Bangalore",12.9696518125,77.7125634626,89
Litti Point,"55/1, Shirdi Sai Layout, 8 A Cross, Near Sai Baba Temple, Brookefield, Bangalore",12.9488280513,77.7130721662,82
Ramji Food Factory,"15, 11th Cross, Chinnapanahalli, Marathahalli, Bangalore",12.9723822000,77.7069545000,6
Guntoor Mirchi,"13, Lower Ground Floor, Forum Shanthinikethan Mall, ITPL Main Road, Whitefield, Bangalore",12.9894504334,77.7280880883,324
Boho,"4th Floor, Brookefields Mall, ITPL Main Road, Brookefield, Bangalore",12.9658336991,77.7181290463,1821
Palace Cuisine,"94, Pattandur Agrahara, Nalluralli Road, Whitefield, Bangalore",12.9771799000,77.7329993000,28
Litti Bhandar,"56, Sai Baba Temple Road, Marathahalli, Bangalore",12.9487968680,77.7128178061,504
Puff & Curries,"Shop 2, SAS Complex, Nallurhalli Main Road, Siddhapura, Varthur Main Road, Whitefield, Bangalore",12.9586145406,77.7319383994,9
Maggination,"89, 1st Main, 6th Cross, Ramagondanahalli, Opposite Jagrati Apartments, Varthur Main Road, Whitefield, Bangalore",12.9563343000,77.7410737000,26
The Fry Shack,"K-06, Lower Ground Floor, Forum Shantiniketan Mall, Whitefield, Bangalore",12.9896460000,77.7277997000,4
Berytoz,"A12, Silver Spring, Spice Garden Layout, Marathahalli, Bangalore",12.9574801057,77.7094832808,15
Cafe Oye Lassi,"G-15, Ground Floor, Brigade Metropolis, Main Road, Whitefield, Bangalore",12.9923230626,77.7032354102,138
Sardar Ji Ka Dhaba,"55/1, Shirdi Sai Layout, 8A Cross, Marathahalli, Bangalore",12.9489020000,77.7120523000,0
Eat Roz,"121/2, Opposite Brigade Tech Gardens, Brookefield, Bangalore",12.9643250000,77.7178660000,129
Marigold Fine Dine Restaurant,"The Twin Oaks, 1/5, Nallurahalli Circle, Whitefield, Bangalore",12.9697276122,77.7355546877,324
Orzuv,"17, Green Park Avenue, Opposite Yamaha Showroom, Whitefield, Bangalore",12.9629058728,77.7479052544,1706
Mealicious,"64/3E, Nallurahalli Main Road, Opposite Doddamma Temple, Whitefield, Bangalore",12.9677577925,77.7342953905,228
Bawarchi Restaurant,"Ground Floor,  1st Main,6th Cross, Ambedkar Nagar, Whitefield, Bangalore",12.9798754161,77.7524868026,1272
Keshari Sweets & Snacks,"75/1, Nallurhalli, Whitefield, Bangalore",12.9697518000,77.7353116000,130
Toscano's Crafted Cakes & Desserts,"63, Unit 12, Upper Ground Floor, Prestige Shanthinikethan Mall, ITPL Main Road, Whitefield, Bangalore",12.9898600000,77.7280800000,12
Paanchforon,"Shop 88/5, Belathur Main Road, Kadugodi, Opposite Trifactra Esplanade, ITPL Main Road, Whitefield, Bangalore",13.0065706841,77.7514138973,0
Bhagini Residency,"10/A, Hoodi Village, K.R. Puram, Whitefield, Bangalore",12.9896085000,77.7132000000,39
Sri Chowdeshwari Mudde Hotel,"967, Raj Palya, Opposite Bajaj Showroom, Whitefield, Bangalore",12.9917441618,77.7206560224,81
Kai Ruchi,"Basaveshwara Nilaya, Sachidananda Ashram Road, Oppositet To Subhodaya Apartment, 2nd Main, 8th Cross, Belathur, Kadugodi Post, KR Puram, Bangalore",13.0071496511,77.7546012787,86
Khichdi Kahani,"153, 2nd Cross Road, Near Water Tank, Kadugodi, Mahadevapura, ITPL Main Road, Whitefield, Bangalore",12.9959040000,77.7692010000,47
The Club Cafe,"229, Gramatana Temple Road, Pattanduru Agrahara, Whitefield, Bangalore",12.9803253000,77.7335002000,11
Layla - The Den Bengaluru,"ITPL Main Road, KIADB Export Promotion Industrial Area, Whitefield, Bangalore",12.9875905410,77.7334042266,477
FNP Cakes,"72/13, Shantamma Building, Nallurahalli Main Road, Siddapura Junction, Near Shell Petrol Bunk, Whitefield, Bangalore",12.9570262650,77.7312996984,126
Best In Klass,"Ground Floor, Sigma Soft Tech Park, Varthur Kodi, Whitefield Main Road, Near Alpha Tower 7, Whitefield, Bangalore",12.9576072071,77.7443925664,57
Jenny's Brownies,"11B, SY 40/9, Devasandra Industrial Area, 2nd Stage, Hobli-MD Pura, KR Puram, Bangalore",12.9962600000,77.6956400000,0
Chakh-Na,"653/23/1/2, Sri Ram Complex, Vasthu Bhoomi Layout, Seegehalli, Whitefield, Bangalore",13.0163282924,77.7622443438,0
The Eatery - Four Points by Sheraton Bengaluru,"Four Points by Sheraton Bengaluru, 43/3, Whitefield Main Road, Whitefield, Bangalore",12.9789952591,77.7511520684,434
The Ice Cream Zone,"9/91, First Floor, Thubarahalli, Mahadevapura, Varthur Main Road, Brookefield, Bangalore",12.9556892468,77.7196213411,2
One Bites,"60 Feet Road, AECS Layout, Kundalahalli, Brookefield, Bangalore",12.9647868606,77.7173656225,14
BIB - Breakfast in the Box,"948, 2nd Floor, Raja Palya, Hoodi, Near Raja Palya Auto Stand, Brookefield, Bangalore",12.9914230000,77.7210170000,628
Dumont,"78/2, Nellurhalli Road, Varthur, Hobli, Siddapura, Whitefield, Bangalore",12.9636831602,77.7323331397,4
Creams & Bites,"9/91, 1st Floor, Thubarahalli, Varthur Main Road, Whitefield, Mahadevapura B.B.M.P East, Brookefield, Bangalore",12.9556980000,77.7191300000,2
Mimi Takeout,"710, Varthur Road, Thubarahalli, Whitefield, Brookefield, Bangalore",12.9562850000,77.7214990000,26
WOW! Momo,"Ground Floor, Sai Paryavaran House, Kundalahalli Main Road, Brookefield, Bangalore",12.9734420000,77.7102090000,8
Ghee and Turmeric,"Survey 111 And 123/2, Ground Floor, Brookefield Mall, Brookefield, Bangalore",12.9658307585,77.7181270346,3
Lassi Corner,"Shop 2, Site 40, Khatha 115/1, Hoodi Main Road, Surya Layout, Ayyappa Nagar, B.B.M.P East, KR Puram, Bangalore",13.0035960063,77.7126244828,371
Five Star Chicken,"Ayyapa Nagar Main Road, KR Puram, Bangalore",13.0042820298,77.7113420516,93
VV Rolls And Shawarma,"194, 1st Floor, Pattandur Agrahara, Near ITPL Gate 3, Whitefield, Bangalore",12.9842199609,77.7340777963,255
Biryani Express,"823, Opposite Bharat Petrol, Bunk Rajpalya Hoodi, Whitefield, Bangalore",12.9908924693,77.7215341106,135
LalChi,"Shop 2, 1st Floor, Apple City Complex, Kadugodi, Seegehalli Road, Whitefield, Bangalore",13.0084240000,77.7587771000,53
Annapoorna Kitchen,"782, First Floor, C Block, Sri Sai Krupa, 2nd Main, AECS Layout, Brookefield, Bangalore",12.9633555669,77.7137555388,104
Dial A Biryani,"Raj Pinnacle Building, Kitchen 4, 1st Floor, Plot 7F, Behind RxDx Hospital, Doddanakundi Industrial Area 2, Mahadevpura, Near Whitefield, Bangalore",12.9769733897,77.7109344993,0
The Home Chef,"Plot 8, 1st Cross, SY No 75, Nandi Infotech Building, Mahadevapura Post, Whitefield, Bangalore",12.9927550000,77.7581970000,0
Hokart - Mane Oota,"6/5, ITPL Main Road, Lakshminarayana Pura, AECS Layout, Marathahalli, Bangalore",12.9592450000,77.7159710000,0
Hokart Andhra Hotel,"Novator Building, Pattandur Agrahara Road, Whitefield, Bangalore",12.9857061000,77.7326861000,0
Spicy Dates,"37, Surya Layout, Ayappa Nagar, KR Puram, Bangalore",13.0032644276,77.7133429796,60
Burger For Breakfast,"D Block, Vaikuntam Layout, Kundanahalli, Near 5th Cross Central, Marathahalli, Bangalore",12.9596636922,77.7121648192,49
The Meaty Bites,"314, 6th Street, Devasandra, KR Puram, Bangalore",13.0046642420,77.7141359076,0
Angaar Biryani,"823, Opposite Bharat Petrol Bunk, Rajpalya Hoodi, Whitefield, Bangalore",12.9907807396,77.7215589210,789
The Mamak,"1/87, Muniyappa Advocate Building, Pattandur Agrahara Road, Pattandur Agrahara, Whitefield, Bangalore",12.9798966522,77.7335889637,0
Highway On The Plate,"Shop 1/87, Muniyyapa Advocate Building, Pattandur Agrahara Main Road, Whitefield, Bengaluru",12.9799051466,77.7336194739,0
Dal Roti,"Building 823, Rajpalya, Hoodi, Opposite Bharat Petrol Pump, Whitefield, Bangalore",12.9823598000,77.7670236000,28
Biryani And Pulao Collection By ITC Hotels,"710, Napa East, Thubarahalli, Whitefield, Bangalore",12.9560695699,77.7215374634,29
Moms Homely Paratha,"8, 2nd Main, 1st Cross, Siddapura, Varthur Main Road, Whitefield, Bangalore",12.9561492946,77.7320426703,12
Yummy Pots,"Near Reliance Smart Supermarket, Kodigehali, KR Puram, Bangalore",13.0045665656,77.7171423286,0
Kattappas Kitchen,"65/1B, Devasandra Main Road, Muneshwara Circle, Ayyappa Nagar, Krishnarajapura, KR Puram, Bangalore",13.0037443182,77.7127378061,22
Nattupura Unavagam,"403, Balaji Paradise, Aravind Avenue Road, Kundalahalli Gate, Marathahalli, Bangalore",12.9633502372,77.6946665648,0
Davanagere Chats,"2/126, SLT Layout, Bhramdevara Gutte, Kodigehalli, Nagarbhavi, Bangalore",12.9725060475,77.4743068591,132
