name,locality,lat,long,review
Nirula's,"17, 1st Floor, 1st Main Road, Above SBI Bank, Shivajinagar, Vasanth Nagar, Bangalore",12.9945593491,77.5937489847,14
Shree Sagar,"267, 18th Cross, Sampige Road, Malleshwaram, Bangalore",13.0080403000,77.5710146000,56
Davanagere Butter Dosa Corner,"71, 1st Main Road, 4th Cross, Basaveshwara Nagar, Bangalore",12.9959663176,77.5305635110,120
Biryani Hunter,"542/1, New Bell Road Devasandra, Sanjay Nagar, Bangalore",13.0377085000,77.5656208000,69
Fabelle Chocolates - ITC Windsor,"25, ITC Windsor, Golf Course Road, Near Sankey Road, Bangalore",12.9945899382,77.5862723508,72
8055 - The Restaurant,"17, 2nd Floor, A.N.Complex ISRO Circle, New BEL Road, Bangalore",13.0343739951,77.5686548964,714
Burger Elite,"34, 9th Cross Road, Mahalakshmipuram Post, B.B.M.P West, Rajajinagar, Bangalore",12.9989800000,77.5497900000,32
Cafe Coco,"F 45, 1st Main 3rd Cross, MSR Nagar, Sanjay Nagar, Bangalore",13.0329340000,77.5672940000,7
Cake & Bake,"59, 8th Main Road, Muthyala Nagar, Jalahalli, Bangalore",13.0362940196,77.5491257384,173
The Delhi Ritual,"Shop 40, First Floor, 1st N Block, 11th Cross Road, Near Madhuloka, Rajajinagar, Bangalore",13.0022429012,77.5527289510,136
The Light House Restaurant,"62, 80 Feet Road, Near MS Ramaiah Hospital, Devasandra Village, RMV 2nd Stage, New BEL Road, Bangalore",13.0283164800,77.5721927360,243
Bangalore Kabab Centre,"Shop 7/1, AMC Road, Near Manju Shree Hospital, RT Nagar, Bangalore",13.0212830448,77.6061290503,83
Hotel Savajis,"1st Floor, 15/121, 14th Cross, 1st Block, Dr. Rajkumar Road, Rajajinagar, Bangalore",13.0000952971,77.5525120273,49
Vinaya Cafe,"RNS Shanthi Niwas, B-Tower, Yeshwantpur, Bangalore",13.0285216134,77.5435638428,14
Kudla Beach,"73, Kantha Complex, 3rd Stage, Dr. Rajkumar Road, Rajajinagar, Bangalore",12.9903285931,77.5583545491,109
Grub Monkeys,"188, Kousalya Building, Devesandra, RMV 2nd Stage, New BEL Road, Bangalore",13.0291602044,77.5710460916,62
Wat-a-Burger! India Ka Burger,"New Bel Road, Dev Asandra Village, Sanjay Nagar, Bangalore",13.0289479000,77.5712389000,22
Roti Curry & Co,"o 70/2, 1st floor, 6 th main, 9th cross, Pillappa Block, Ganganagar, Yelahanka, RT Nagar, Bangalore",13.0253164300,77.5904049800,32
Dock Frost'd,"Shop 1, 2, 3, 4, Ground Floor, Bindu Galaxy, 1St Main Road, Industrial Town, Rajajinagar, Bangalore",12.9834740951,77.5488105789,102
Bowl Soul,"Freshmenu 75, 2 Block, 1st Main, Dr. Rajkumar Road, Near KTM Showroom, Rajajinagar, Bangalore",12.9928398000,77.5563812000,25
Rasapaka,"30/1, 5th Main Road, Gandhinagar, Majestic, Bangalore",12.9794536338,77.5770552456,96
The Sugar Free Keto Kafe - By Artinci,"1042, Gokula 1st Stage 2nd Phase, Triveni Road, Yeshwantpur, Bangalore",13.0271398000,77.5610604000,56
Mamma Rotti Family Restaurant,"Near Saint Claret School, MES Road, Outer Ring Road, Sharadhambha Nagar, Jalahalli, Bangalore",13.0416677632,77.5468693301,83
The Home Food,"16, M R Pallya, RT Nagar, Bangalore",13.0304300000,77.6005320000,289
Sri Ram Bhojanalay,"5, 2nd Cross, Msre College Road, Mathikere, Yeshwantpur, Bangalore",13.0308371921,77.5622558221,627
Ayodhya Aahar,"2/10, 80 Feet Road, RMV 2nd Stage, Poojary Layout, New BEL Road, Bangalore",13.0272708849,77.5767434388,16
Mandarin By Sabroso,"503, 1st Floor, 5th Cross Pipeline Road, MSR Nagar, Sanjay Nagar, Bangalore",13.0333378503,77.5656835634,252
Winners Pizza - Fresh Dough,"Dollar Colony, RMV 2nd Stage, Next to Pet Zone, New BEL Road, Bangalore",13.0379081400,77.5685401500,11
Nisarga Grand,"37, Ground Floor, 10TH Cross, Laksmaiah Block, CBI Road, Ganganagar, RT Nagar, Bangalore",13.0265008000,77.5876230000,163
Drunken Monkey,"Shop 2, 726/6, 1st Floor, Prakash Enclave, 3rd Block, 41st Cross, ESI Main Road, Rajajinagar, Bangalore",12.9897935000,77.5556783000,23
Tharavadu Malabar Biryani,"Municipal 193, 2nd, 3rd Floor, M H Chandrappa, Mathikere, Near Gowri Apartments, New BEL Road, Bangalore",13.0391128651,77.5641078874,655
Crepito,"837/A, Kamalamma Arcade, Dr. Mc Modi Hospital Road, Rajajinagar, Bangalore",12.9974697328,77.5450816378,153
Esplanade,"201, Double Road, Indiranagar, Bangalore",12.9786731222,77.6365754753,1900
New Punjabi Dhaba,"11, 1st Cross MSR Nagar, Mathikere, 1st Main Road, Yeshwantpur, Bangalore",13.0325693706,77.5666693971,181
New A1 Chicken Biryani Point,"17, 1st D Main, Thimmaiah Road, Shivanagar, Rajajinagar, Bangalore",12.9902257000,77.5458035000,28
Kolkata Famous Kati Rolls,"38, 1st R Block, Sultanpalya Main Road, Sultanpalya, RT Nagar, Bangalore",13.0278951067,77.6043906435,1314
Hotel New Panchavati,"54/54, 17th Cross, MRCR Layout, Vijay Nagar Bus Stand, Vijay Nagar, Bangalore",12.9727354043,77.5379315391,81
Connie's Restaurant & Steakhouse,"305, Nehru Road, Kammanahalli, Bangalore",13.0149195096,77.6330662763,1573
Royal Garden Family Restaurant,"1st Stage, Tumkur Road, Peenya, Bangalore",13.0359481127,77.5252068043,87
Om Sai Ram Food Junction,"8/1, 3rd Cross, Chilla Maranahalli, New BEL Road, Bangalore",13.0309302852,77.5621954724,1332
Mint Masala,"384/1, Bashyam Circle, Sadashiv Nagar, Bangalore",13.0068513341,77.5788033754,639
The Taste Hub,"45/1, 3nd Main Road, KHM Block, Ganga Nagar, RT Nagar, Bangalore",13.0229853000,77.5922941000,61
Jaggery Cafe,"57/B, Krishna Building, Yeshwantpur, Bangalore",13.0306826902,77.5598056242,75
Slay Coffee Bar,"14, Shanthala Nagar, Sampangi Rama Nagar, St. Marks Road, Bangalore",12.9714200000,77.6007013000,7
ATH - All Things Healthy!,"408, 1st Floor, 3rd Cross, Shridi Sai Hospital, Back Side Road, Devasandra, B.B.M.P North, Sanjay Nagar, Bangalore",13.0371531474,77.5647920881,218
Rice Sambar,"13, 2nd Cross, MSR Main Road, Yeshwantpur, Bangalore",13.0193407466,77.5618115813,11
Cold Stone Creamery,"K LGF 2, First Floor, Global Mall, 19/2 Part Of CTS Mysore Deviation Road, Gopalapuram, Rajajinagar, Bangalore",12.9815080000,77.5631920000,36
Amogha Sagar Grand,"26, 1st Main, 3rd Stage, 3rd Block, Basaveshwara Nagar, Bangalore",12.9869374681,77.5399311259,10
Udupi Ruchi,"793/1, 17th E Main, 59th Cross, 5th Block, Rajajinagar, Bangalore",12.9858498807,77.5523021445,86
PVR Café,"4th Level, 3rd Floor, Orion Mall, Raj Kumar Road, Malleshwaram, Bangalore",13.0107717178,77.5550158694,41
Veg Daawat By Behrouz,"No.178, Central Hall, GF, Seshadripuram, Bangalore",12.9896094000,77.5721166000,17
Cool City,"13, 2nd Cross Road, Subedhar Palya Temple, Opposite Tata Institute, Malleshwaram, Bangalore",13.0194200000,77.5618950000,4117
Pulusu,"38, Chikkamaranahalli, Near Devasandra Bus Stop, New BEL Road, Bangalore",13.0358648206,77.5668943673,169
Sikandar,"84/142, 12th & 13th Floor, Barton Center, MG Road, Bangalore",12.9755435372,77.6058497652,259
Appu Biryani Centre,"8, Kempegowda Nagar, Laggere Ring Road, Near Basaveshwara Nagar, Bangalore",13.0020170000,77.5255140000,0
Garden Kabab Corner,"64/1, MS Complex, SC Road, Yeshwantpur, Bangalore",13.0190761539,77.5574362278,26
Hotel Chandrika,"9/1, Old 7/9, Commerce House, Cunningham Road, Bangalore",12.9906549014,77.5929618000,241
Hotel Nalapaka,"28, 12th Main, 1st Block, Rajajinagar, Bangalore",12.9984305155,77.5522951037,870
3 Mangos,"8/1, Ground Floor, Murugeshpalya Road, Frazer Town, Bangalore",12.9992207000,77.6156156000,404
Hatch,"30,1st Cross, Sampige Road, Malleshwaram, Bangalore",12.9938098386,77.5714997202,553
Kutumba Kitchen,"104, Terrace Floor, AG's Layout, ISRO Road, Near Defy Networks, New BEL Road, Bangalore",13.0344870985,77.5688896435,136
Bong Connection,"2/1, Cross 1, Mathikere, MSR College Road, Yeshwantpur, Bangalore",13.0301009391,77.5624707341,51
Signature Wraps & Rolls By Faasos,"2884, 14th Cross, E Block, Rajaji Nagar, 2nd Stage, Rajajinagara, BBMP West, Malleshwaram, Bangalore",13.0033000000,77.5585000000,0
House of Mughals,"Ground Floor, 001 & 002, 003 & 004, Bindu Galaxy, 1st Main Road, Industrial Town, West of Chord Road, Rajajinagar, Bangalore",12.9835410000,77.5487580000,12
Fish Land KSCFF,"Nandini Layout, Rajajinagar, Bangalore",13.0120852497,77.5357750431,6
Chin Lung Resto Bar,"206, KGE Layout, Devasandra Layout, Near Reebok Showroom, New BEL Road, Bangalore",13.0300111121,77.5705529004,823
Maarish Food Joint,"23, 6th Cross, 4th Block, Near Dr. Rajkumar Punya Bhumi, Nandini Layout, Rajajinagar, Bangalore",13.0171730377,77.5316249952,559
Kolkata Victoria Chat House,"373/1, Mallikarjuna Complex, 80 Feet Road, RT Nagar, Bangalore",13.0249885912,77.5926554202,98
Boobacha,"4/1, 2nd Cross, 2nd Main Road, VR Puram Palace, Sankey Road, Bangalore",13.0014654000,77.5810154000,69
Fit Feast,"19/1, Second Floor, 7th B Cross, Gokula 1st Stage, Near Mathikere Main Road, Yeshwantpur, Bangalore",13.0258710000,77.5612510000,2753
Sangam House Of Kebabs,"38/1, 7th Main Road, Vijay Nagar, Bangalore",12.9644281115,77.5546252728,43
Grand Foodies Restaurant,"119/19, 8th Main Road, Vasanth Nagar, Bangalore",12.9925896441,77.5921926275,43
Pizza Brew House,"206, Ground Floor, Devasandra, Mathikere, New BEL Road, Bangalore",13.0300731744,77.5706249848,209
Shyam Mishra Juice Centre,"7/3, Corporation 7, Ground Floor, Kanakavani Building, 27th Cross, R T Street, Majestic, Bangalore",12.9706300000,77.5781000000,134
Midnight Eats,"16/17, HKP Road, Broadway Road, Shivajinagar, Bangalore",12.9859546000,77.6050501000,2643
Trattoria By Toscano,"Survey 1, Museum Road, Off MG Road, Shivajinagara, Church Street, Bangalore",12.9749375000,77.6029375000,8
Happy Hours,"11, Hare Krishna Road, Kumar Park East, Shivananda Circle, Seshadripuram, Bangalore",12.9871129061,77.5785965100,53
Lassi 'n' Mock,"60, 80 Feet Road, Devasandra, Sanjay Nagar, Bangalore",13.0281861000,77.5726316000,83
Baf's Cafe,"75, Basaveshwara Nagar, Bangalore",12.9981110173,77.5407783687,55
Nizam's Kitchens,"2nd, 3rd Floor, Municipal 193, M H Chandrappa, Near Gowri Apartments, Mathikere, New BEL Road, Bangalore",13.0391739452,77.5640720129,381
MM Prashanth Hotel,"522/B, A Block, 2nd Phase, Subramanya Nagar, 1st Main Road, Rajajinagar, Bangalore",13.0080864854,77.5548160449,64
Queens Restaurant,"45, 1st Main, KGE Layout, RMV Extention, 2nd Stage, New BEL Road, Bangalore",13.0286310396,77.5719489902,16
New Govind Rao Military Hotel,"6, 758, Cottonpet Main Road, Bhashyam Circle, Chikkapete, Majestic, Bangalore",12.9727631754,77.5702236593,158
22 Se Srabon,"6, Ground Floor, 5th Cross Street, H M R Layout, Gokula Mathikere, Near Anjani Temple, Yeshwanthapura, New BEL Road, Bangalore",13.0410490000,77.5541761000,246
LM Paradise Cuisines And Cafe,"Shop 1, Ground Floor, Priya Apartment, Gundappa Reddy Layout, 2nd Cross, Cholanayakanahalli, Near Rajiv Gandhi Dental College, RT Nagar, Bangalore",13.0340425130,77.5967892632,170
A1 Ambur Chicken Biriyani Point,"21, Triveni Road, Yeshwantpur, Bangalore",13.0192907680,77.5579364598,583
Royal Savera Family Restaurant,"67, M M Road, Frazer Town, Bangalore",13.0006758119,77.6152985170,60
Papa Roll's,"13, 2nd Cross Road, Subedhar Palya Temple, Opposite Tata Instituete, Yeshwantpur, Bangalore",13.0194024849,77.5618729368,1819
Lakshmi Juice Centre,"31/1, J Lingaiah Road, 1st Main Road, Seshadripuram, Bangalore",12.9898725839,77.5740370293,182
Holy Doh!,"148 & 149, Plan B, S Jayawanthi, Ashok Nagar, Brigade Road, Bangalore",12.9692244585,77.6064147055,235
GFC Biryani,"34, Chikanna Building, Geddalahalli, Sanjay Nagar, Bangalore",13.0297735000,77.5781680000,0
Bowl 99,"73/1, 3rd Cross, S B M Colony, Mathikere, Yeshwantpur, Bangalore",13.0365860000,77.5564410000,30
V Cafe- Meals By PVR,"3rd Floor, Orion Mall, Rajkumar Road, Rajajinagar, Malleshwaram, Bangalore",13.0108497916,77.5549766421,90
Fat Cat Pizza Company,"18, Third Floor, 17/F Cross Road, Second Stage, Indiranagar, Bangalore",12.9790063000,77.6331316000,225
Asia Seven,"FC 14 And 15, 3rd Floor, Mantri Square 1, Sampige Road, Malleshwaram, Bangalore",12.9917110000,77.5706360000,0
Candice's Gourmet Sandwiches,"218, Double Road, Indira Nagar, Stage 2, Hoysala Nagar, Indiranagar, Bangalore",12.9810878320,77.6371816546,592
Mane Holige Kuruku Thindi,"6 & 6/2, Gurukrupka Building, 8th Cross, Malleshwaram, Bangalore",12.9993024365,77.5725313649,54
Bombay Kulfi &  Rabri,"25, 1st Floor, 1st B Main, 1st Cross, Behind AICA Laminates, Shanti Nagar, Bangalore",12.9572709000,77.5872362000,214
Dil Tiffins,"1/2, 1St Main Road, Gandhi Nagar, Kalidasa Marg, Majestic, Bangalore",12.9751150000,77.5787060000,18
Green Cravings,"75, Dr.Rajkumar Road Rajajinagar, 2 Block, 1st Main, Near KTM Showroom, Rajajinagar, Bangalore",12.9928398000,77.5563812000,26
Ambur Biriyani House,"316, Triveni Road, Opposite Pavithra Lodge, Yeshwantpur, Bangalore",13.0208874653,77.5584843010,173
Khichdi Kahani,"1/1 First Floor, 4Th Cross, Old Pension Mohalla, Mysore Road, Chikkapete, B.B.M.P West, Basavanagudi, Bangalore",12.9634440000,77.5671530000,6
Edesia by Freshmenu,"75, 2nd Floor, 1st Main, Dr. Raj Kumar Road, Rajajinagar, Bangalore",12.9925736361,77.5567492470,283
Ice Fort,"54, 1st Main Road, 80 Feet Ring Road, Basaveshwara Nagar, Bangalore",12.9867362207,77.5399244204,58
Sree Ganesha Fruit Juice Centre,"66, Coles Road, Frazer Town, Bangalore",12.9954831451,77.6140093803,0
Delhi Dhaba,"Shop 4, Cholanayakanahalli, Seethappa Layout, RT Nagar, Bangalore",13.0341113000,77.5966914000,280
The Happy Fields Kitchen,"4/A, 1st Cross, Muthyala Nagar, Opposite Sai Residency, New BEL Road, Bangalore",13.0398335400,77.5525975000,94
Annapoorneswari Dose Corner,"179, 1st Main, RHCS Layout, Naagarabhaavi, Basaveshwara Nagar, Bangalore",12.9910651509,77.5407907642,37
Armani Kitchen,"06, 1st Main Road, Rahamth Nagar, 1st Main Road, Opposite Indian Oil Petrol Pump, RT Nagar, Bangalore",13.0182056090,77.5920280069,514
Thin Tony's Pizza,"948, 12th Main, HAL 2nd Stage, Indiranagar, Bangalore",12.9701936000,77.6390170000,40
The Celebration Cakes And Desserts,"7, 3rd Floor, Pipeline Road, Near 2nd Main Road, Mathikare, Malleshwaram, Bangalore",13.0331600000,77.5661210000,45
Charminar Kabab Paradise,"40, Mosque Complex, MM Road, Frazer Town, Bangalore",13.0005108374,77.6150460541,151
Protein Chef,"408, 1st Floor, 3rd Cross, Shridi Sai Hospital, Back Side Road, Devasandra, B.B.M.P North, Sanjay Nagar, Bangalore",13.0371531474,77.5647920881,29
Starboy Pizza & Shakes,"Dollar Colony, RMV 2nd Stage, Next to Pet Zone, New BEL Road, Bangalore",13.0379081400,77.5685401500,38
Eden Park,"21/1, Near The Hindu, Cunningham Road, Bangalore",12.9830879297,77.5986000896,787
Slurpy Shakes,"76/77, Padmavathi Complex, 8th Main, Vasanth Nagar, Bangalore",12.9922253814,77.5942649692,16
CupCake Noggins By CakeZone,"255, AECS Layout, Geddalahalli, Opposite Indian Oil Petrol Bank, Sanjaynagar Main Road, Sanjay Nagar, Bangalore",13.0289130000,77.5789680000,22
Vaibhav Biryani,"409, 1st Block, 20th Main Road, Rajajinagar, Bangalore",12.9986670354,77.5503659248,448
Gourmet Ice Cream Cakes By Baskin Robbins,"C3, Brigade Orion Mall, Brigade Gateway, Dr Rajkumar Road, Malleshwaram, Bangalore",13.0115760000,77.5554280000,8
Shamsi's Rolls & Kebabs,"15/1, Chinnappa Garden, 2nd Main Road, Frazer Town, Bangalore",13.0048818087,77.6031196117,97
Nammura Naati Mane,"2/3, Poojari Layout, 80 Feet Road, Ashwath Nagar, Near Sanjay Nagar, Bangalore",13.0274324000,77.5763795000,12
Park Street,"313, Gokula Extension, Mathikere, MSR Nagar, New BEL Road, Bangalore",13.0351467000,77.5636567000,122
Shree Sagar Veg Fast Food,"1/2, Old 1/3, 1st Main Road, Kalidasa Marg, Gandhi Nagar, Majestic, Bangalore",12.9752981739,77.5789234042,7
Sri Krishna Delicacy,"5, 10th Cross, CBI Road, Ganga Nagar, RT Nagar, Bangalore",13.0265369534,77.5872271250,127
Hotel Karnataka,"791, Guddanna Complex, Kamakshipalya, Magadi Road, Bangalore",12.9838981575,77.5285612419,492
S M Sea Fishes,"Shop 39, /1, 1st Main, 2nd Cross, RT Nagar, Bangalore",13.0232771000,77.5923746000,53
Tasty Munch,"81, 1st Block, 19th Main Road, Opposite PVP College, Rajajinagar, Bangalore",13.0044799962,77.5498398766,53
AR Cafe,"38, 8th Cross, 8th Main, Nandini Layout, 3rd Block, Peenya, Bangalore",13.0157960000,77.5295760000,222
Sri Ranganatha Military Hotel,"259/1, 1st Cross, 3rd Main, Chamarajapet, Near LIC Office, Basavanagudi, Bangalore",12.9588128701,77.5694065914,9
Naaan Veg Ootada Mane,"13, 2nd Cross Road, Subedar Palya Temple, Opposite Tata Institute, Yeshwantpur, Bangalore",13.0193789655,77.5618853420,5709
Desi Vdesi,"Shop 6, and 48, Trimph Tower, Church Street, Shanthinagar, B.B.M.P, Church Street, Bangalore",12.9755004108,77.6032456756,199
Haji Ali Juice Centre,"Nisa Enclave, MM Road, Frazer Town, Bangalore",13.0008597339,77.6130531728,27
Tawa Tandoor,"25/1, 4th Floor, 2nd Main Road, Prestige Stay Inn, Sanjeeappa Colony, Poornapura, New BEL Road, Bangalore",13.0409782504,77.5628522784,327
Cafe Noir,"Orion Mall, Brigade Gateway, Dr. Rajkumar Road, Malleshwaram, Bangalore",13.0111663334,77.5543842092,1403
Smokin Burg,"39/1, Mani Business Centre, Frazer Town, Bangalore",12.9954034330,77.6141854003,211
Sree Ganesha Fruit Juice Center,"29/3, NRS Complex, Mattikere, MSR College Road, New BEL Road, Bangalore",13.0298716353,77.5620194525,3
Infinitea Tea Room & Tea Store,"17/1, Ali Askar Road, Shivajinagar, Bangalore",12.9870889423,77.5947348817,944
Mysuru Sri Hanumanthu Palav,"36/1, 80 Feet Road, Near Mischief Studio, Basaveshwara Nagar, Bangalore",12.9868414182,77.5372217596,4
Andhra Meal Co,"6/2, 12th Cross, 60 Feet Road, JC Nagar, Mahalakshmipuram, Basaveshwara Nagar, Bangalore",13.0061763100,77.5351899300,38
Mubarak Restaurant,"61/2, Near Veeresh Theater, Magadi Road, Rajajinagar, Bangalore",12.9775845186,77.5437911600,4
Peppy Parathas & Rolls by Chai Point,"L16-64, 18th Cross, Margosa Road, Malleshwaram, Bangalore",13.0085283000,77.5693717000,7
Venus Bar And Restaurant,"45/4, Opposite More Hypermarket, Tumkur Road, Yeshwantpur, Bangalore",13.0245028620,77.5481165573,151
Pebo,"218, MGECHBS, Devasandra, Aramane Nagar, Near Sanjay Nagar, Bangalore",13.0290496000,77.5707409000,280
Nandini Swadista Loka,"KSDL Building, Opposite Ravindu Toyota Showroom, Srigandha Nagar, Rajajinagar, Bangalore",13.0125459000,77.5524881000,18
Heavenly,"86, 2nd Cross Papayareddy Layout, Hebbal, Bangalore",13.0280574498,77.6046850160,486
Tarangini,"31/1 New Bel Road, Devasandra, Sanjay Nagar, Bangalore",13.0313714000,77.5701992000,15
Sri Ramji Sweet And Chats,"178, 1st Main Road, Munnireddy Palya, JC Nagar, RT Nagar, Bangalore",13.0101335000,77.5948793000,193
Tasty Food,"84/4, 14th Cross, 14 Main, Mathikere, M S R College Road, Yeshwantpur, Bangalore",13.0311883324,77.5623041019,20
Ipsha's Kitchen,"B1103, Purva Sunflower, Rajajinagar, Bangalore",12.9768299000,77.5571530000,204
The Punjabi Kitchen,"Ground Floor, MSR Nagar, Mathikere, Triveni Main Road, Near Shiva Temple, Yeshwantpur, Bangalore",13.0308946000,77.5622675000,15
Bheema's,"31, Church Street, Bangalore",12.9752338110,77.6039108634,871
Juice Adda,"47, 10th Cross, 2nd Stage, Rajajinagar, Bangalore",12.9993419000,77.5494216000,10
S G Rao’s Military Hotel,"221, Police Station Road, Opposite Karnataka Bank ATM, Ranasingpet, Majestic, Bangalore",12.9675656778,77.5709334388,147
Balaji Kabab Corner - Gowdru Natti Style,"4th Main, 1st Stage, Triveni Road, Yeshwantpur, Bangalore",13.0279496566,77.5613398477,134
Sorbetto,"1, PID, 3rd Floor, Kalpana Chawla Road, Bhoopasandra, Hebbal, Sanjay Nagar, Bangalore",13.0426385184,77.5798229263,176
Abhiruchi Hindu Military Hotel,"Near Sangitha Showroom, 18th Cross, Sampige Road, Malleshwaram, Bangalore",13.0079894637,77.5711745024,61
The Grill & Cheese Cafe,"G1, Smart Plaza, 64 Coles Road, Frazer Town, Bangalore",12.9951417549,77.6144063473,31
Hotel New Grand,"12/12, Cottonpet Main Road, Tank Road, Majestic, Bangalore",12.9738723834,77.5703906268,10
Savera Lassi Shop,"12, 2nd Floor, Near RB Super Market, Chandni Chowk Road, Shivajinagar, Bangalore",12.9852366000,77.6035035000,129
Dolci Desserts,"18/3, Near Kingfisher Airlines Office, Ali Askar Road, Cunningham Road, Bangalore",12.9864938088,77.5950367749,828
Kingsway Restaurant,"6/17, HKP Road Broadway, Shivajinagar, Bangalore",12.9859681467,77.6050015166,411
Karachi Bakery,"73, 80 Feet Road, RMV Stage 2, Near Ramaiah Hospital, Sanjay Nagar, Bangalore",13.0278406000,77.5734986000,31
Salt Mango Tree,"971, 5th Cross, 12th Main, HAL 2nd Stage, Indiranagar, Bangalore",12.9697583241,77.6388235018,390
Northwind,"31/4, 1st Main Road, Seshadripuram, Bangalore",12.9979672756,77.5813873485,108
Pattegar Donne Biriyani,"9, 2nd Cross, Pipeline Road, Vijay Nagar, Bangalore",12.9715729358,77.5469880179,9
Shree Swathi Cafe,"76/3, 11th Cross, 1st N Block, Rajajinagar, Bangalore",13.0023607000,77.5530066000,44
Shezan,"Sultan Shah Complex, Cunningham Road, Bangalore",12.9871756324,77.5947990641,666
De Zyka Cafe,"30, First floor, Kamaraj Road, Shivajinagar, Bangalore",12.9827406000,77.6106452000,10
Badmaash,"203, 2nd Floor, The Collection, UB City, 24, Vittal Mallya Road, Near Lavelle Road, Bangalore",12.9722541469,77.5961596146,539
Himadri Ice Cream,"4, K.G Circle, Majestic, Bangalore",12.9748838983,77.5755381212,49
Robin Brown Ice Creams,"MIG 45/3, Ground floor, KHB Colony, 2nd Stage, Rajajinagar, Bangalore",12.9869498827,77.5373934209,24
Hard Rock Cafe,"4 & 16, St. Marks Road, Bangalore",12.9759532377,77.6016185805,6612
Tandoor,"28, Centenary Building, MG Road, Bangalore",12.9739844474,77.6124587283,1581
The Rice Bowl,"40/2, Lavelle Road, Bangalore",12.9747447173,77.5995767489,953
The Royal Corner - Pai Viceroy,"Pai Viceroy, 1504, 16th Cross, 9th Main, 3rd Block, Jayanagar, Bangalore",12.9360692925,77.5838566571,833
Combos Jumbos Mumbos,"13, 2nd Cross, Subedarpalya Temple Road, Yeshwantpur, Bangalore",13.0193237604,77.5618531555,21
Green Theory,"15, Convent Road, Near Residency Road, Bangalore",12.9683694217,77.6029070467,3200
INOX,"1, 3rd Floor, Mantri Square, Sampige Road, Malleshwaram, Bangalore",12.9920110705,77.5703369826,17
Soda Bottle Opener Wala,"25/4, Opposite Harley Davidson Showroom, Lavelle Road, Bangalore",12.9706117226,77.5976167247,4576
Facecake,"16, 2nd Cross, Ganesha Block, Dinnur Main Road, RT Nagar, Bangalore",13.0226706712,77.6015763357,303
Soroush Biryani,"75, 2nd Floor, Dr Rajkumar Road, Rajajinagar, Bangalore",12.9929153566,77.5566238537,217
Mitti Cafe,"Stage 1, Platinum City, Industrial Area, Watch Factory Road, Peenya, Bangalore",13.0355392000,77.5319307000,482
Spices Food Joint,"422, 6th Block, Dr Raj Kumar Road, Rajajinagar, Bangalore",12.9798476458,77.5537639484,46
Bharath Restaurant,"A1 - A2, BEL Market, Jalahalli, Bangalore",13.0519854026,77.5518166646,47
Karavali Deluxe,"Opposite Yeshwanthpura Circle, Subedar Chatroom Road, Yeshwantpur, Bangalore",13.0190872602,77.5571864471,38
Lazio Steaks & More,"13, 1st Floor Azeem Gold, Mosque Road, Frazer Town, Bangalore",12.9975334366,77.6145622507,155
World Brew Cafe,"1527, MSR Engineering College, 2nd Cross, Near NIAS Gate, Mathikere Extension, New BEL Road, Bangalore",13.0299804076,77.5631251931,50
Taste Of Kolkata,"60, 4th Cross, HMR Layout, Gokula, Near Hanuman Temple, New BEL Road, Bangalore",13.0410733000,77.5541541000,400
Xpress Rolls,"5/1, 1st Cross Road, Near Veeresh Theatre Layout, Vijay Nagar, Bangalore",12.9771250000,77.5454370000,99
Taiyvan's,"1/1, Third Floor, Near Bellary Road, CBI Road, Ganganagar, RT Nagar, Bangalore",13.0269763000,77.5860911000,101
A1 Chicken Biryani Point,"Hebballa Circle, Vasantha Block, CBI Road, RT Nagar, Bangalore",13.0262310000,77.5887990000,0
The Best Snacks Adda,"3rd Cross, Chikka Maranahalli, New BEL Road, Bangalore",13.0308260863,77.5622799620,127
Shalimar Family Restaurant,"24, HKP Broadway Road, Shivajinagar, Bangalore",12.9858737300,77.6051470265,4
Socialize,"641, 3rd Block, 2nd Cross, 9th Main, 3rd Stage, Basaveshwara Nagar, Bangalore",12.9924928000,77.5391731000,400
Kitty's Corner,"29, Fourth Cross, MSR College Road, Gokula 1st Stage, Mathikere Extension, Mathikere, Yeshwantpur, Bangalore",13.0292908622,77.5618648902,7
Ocea Hotel,"72, Chetalli Trade Center, Markham Road, Near St. Joseph's College Of Commerce, Near Brigade Road, Bangalore",12.9698373910,77.6069367304,290
The Snackstop - Eswaris Homemade Snacks,"3145, Sai Baba Temple Road, Hal 2nd Stage, Near ESI Hospital Signal, Indiranagar, Bangalore",12.9716475000,77.6357319000,168
The Ultimate Food,"319, 6Th Main Road, 9Th Cross, Msr Nagar, Mathikere, Sanjay Nagar, Bangalore",13.0347565430,77.5639432669,23
Roti Curry & Co,"73/1, 3rd Cross, S B M Colony, Mathikere, Yeshwantpur, Bangalore",13.0365860000,77.5564410000,4
Shiro,"2nd Floor, UB City Mall, Vittal Mallya Road, Near Lavelle Road, Bangalore",12.9717761558,77.5964824855,2543
Ambur Hot Dum Biryani,"03, Cholanayakanahalli Road, Muneshwara Block, Near Anganawadi Kendra, Hebbal, Bangalore",13.0359559519,77.5969867408,16
Sanadige - Goldfinch Hotel,"Goldfinch Hotel, 32/3, Crescent Road, Off Race Course Road, Near Shivananda Circle, Seshadripuram, Bangalore",12.9853875975,77.5796576589,816
Shaken & Stirred,"33, 5th Main, Sheshadri Road, Near Ananda Rao Circle, Race Course Road, Bangalore",12.9800577199,77.5769724324,311
Fusion Biryani,"1st Floor, Pillappa Block, Ganganagar, RT Nagar, Bangalore",13.0253164300,77.5904049800,3
The Meals Junction,"3rd Cross, RMV 2nd Stage, Chikkamaranhalli, Sanjay Nagar, Bangalore",13.0308734000,77.5622637000,31
New Mangaluru Lanch Home,"61, Goraguntepala, Mahalakshmipuram, 1st Main Road, Yeshwantpur, Bangalore",13.0273046000,77.5394313000,0
Kobe Sizzlers,"83, 1st Floor, RMV 2nd Stage, KGE Layout, 80 Feet Road, Sanjay Nagar, Bangalore",13.0281900000,77.5732000000,1387
Karnatic,"30, MG Road, Old 1st and 2nd Floor, Church Street, Bangalore",12.9751038000,77.6037166000,593
Deli2Go,"12, PID 78-46-69/2, Near Millers Road, Vasanth Nagar, Bangalore",12.9907647316,77.5936839357,8
Cheesecakes By CakeZone,"119, Raj Driva, 2nd Floor, Dr Rajkumar Road, Rajajinagar, Bangalore",12.9998260000,77.5525220000,0
The Lassi Corner,"Shop-02, Old-459, 3rd Main Road, Sadashiv Nagar, Bangalore",13.0074084375,77.5784180963,0
JIANG Pure Veg,"Vasudev Adigas, 1st Cross, K.G. Road, Majestic, Bangalore",12.9736429977,77.5791205384,120
